{
  "$schema": "https://json-schema.org/draft/2020-12/schema",
  "title": "Constellation",
  "type": "object",
  "required": [
    "id",
    "name",
    "gen",
    "meaning",
    "rank",
    "focus",
    "label",
    "bound",
    "lines",
    "bright"
  ],
  "properties": {
    "id": {
      "type": "string"
    },
    "name": {
      "type": "string"
    },
    "gen": {
      "type": "string"
    },
    "meaning": {
      "type": "string"
    },
    "rank": {
      "type": "integer"
    },
    "focus": {
      "type": [
        "array",
        "null"
      ],
      "items": {
        "type": "number"
      }
    },
    "label": {
      "type": [
        "array",
        "null"
      ],
      "items": {
        "type": "number"
      }
    },
    "bound": {
      "type": [
        "array",
        "null"
      ]
    },
    "lines": {
      "type": [
        "array",
        "null"
      ]
    },
    "bright": {
      "type": [
        "string",
        "null"
      ]
    }
  },
  "additionalProperties": false
}