{
  "id": "Mon",
  "name": "Monoceros",
  "gen": "Monocerotis",
  "meaning": "Unicorn",
  "rank": 1,
  "focus": [
    105,
    0,
    73
  ],
  "label": [
    114.75,
    -6
  ],
  "bound": [
    [
      [
        95.2257,
        -0.0537
      ],
      [
        95.348,
        9.9455
      ],
      [
        96.3477,
        9.9334
      ],
      [
        96.3728,
        11.9333
      ],
      [
        105.7428,
        11.8213
      ],
      [
        105.7185,
        9.8215
      ],
      [
        106.7179,
        9.8098
      ],
      [
        106.6643,
        5.3101
      ],
      [
        106.9143,
        5.3072
      ],
      [
        106.8674,
        1.3074
      ],
      [
        109.6169,
        1.2756
      ],
      [
        109.5997,
        -0.2243
      ],
      [
        122.849,
        -0.3694
      ],
      [
        122.7342,
        -11.3688
      ],
      [
        111.9734,
        -11.2521
      ],
      [
        93.2156,
        -11.0302
      ],
      [
        88.9658,
        -10.9785
      ],
      [
        89.0524,
        -3.9791
      ],
      [
        95.1771,
        -4.0534
      ]
    ]
  ],
  "lines": [
    [
      "s_monocerotis",
      "13_monocerotis",
      "epsilon_monocerotis_a",
      "epsilon_monocerotis_a",
      "18_monocerotis",
      "13_monocerotis",
      "18_monocerotis",
      "delta_monocerotis",
      "beta_1_monocerotis",
      "gamma_monocerotis",
      "beta_1_monocerotis",
      "delta_monocerotis",
      "zeta_monocerotis",
      "alpha_monocerotis"
    ]
  ],
  "bright": "beta_1_monocerotis"
}