{
  "id": "Hyi",
  "name": "Hydrus",
  "gen": "Hydri",
  "meaning": "Male Water Snake",
  "rank": 2,
  "focus": [
    35.1637,
    -69.9564,
    102
  ],
  "label": [
    34.5,
    -72
  ],
  "bound": [
    [
      [
        68.794,
        -67.2479
      ],
      [
        68.5815,
        -69.7467
      ],
      [
        67.9575,
        -74.7432
      ],
      [
        52.0758,
        -74.5741
      ],
      [
        50.0917,
        -82.0645
      ],
      [
        1.5334,
        -81.804
      ],
      [
        1.5663,
        -74.304
      ],
      [
        12.3324,
        -74.3186
      ],
      [
        12.2954,
        -75.3185
      ],
      [
        20.6541,
        -75.3472
      ],
      [
        21.2062,
        -57.8484
      ],
      [
        33.4894,
        -57.9162
      ],
      [
        33.2024,
        -66.9152
      ],
      [
        48.3627,
        -67.0358
      ]
    ]
  ],
  "lines": [
    [
      "beta_hydri",
      "gamma_hydri",
      "delta_hydri",
      "alpha_hydri",
      "beta_hydri"
    ]
  ],
  "bright": "beta_hydri"
}